{"run":133,"commit":"e6889c1","metric":1977,"metrics":{"god_object_lines":495,"source_modules":76,"test_files":115},"status":"keep","description":"ConnectionHealthMonitor — production stale peer detection: activity tracking, configurable staleness threshold, auto-removal, health stats, isStale/getTimeSinceActivity queries (17 new tests, 76 source modules)","timestamp":1773738962730,"segment":0}
{"run":134,"commit":"abfb012","metric":1992,"metrics":{"god_object_lines":495,"source_modules":77,"test_files":116},"status":"keep","description":"RateLimiter — sliding window rate limiting for production DoS protection: per-key limits, window expiry, remaining/retryAfter queries, burst handling (15 new tests, 77 source modules, 116 test files)","timestamp":1773739053914,"segment":0}
{"run":135,"commit":"dfd0a25","metric":2000,"metrics":{"god_object_lines":495,"source_modules":77,"test_files":117},"status":"keep","description":"🎉🎉 2000 TESTS! Production readiness validation — rate limiter + connection health integration, startup validation completeness, rate limiter edge cases (8 new tests, 14.8x original baseline! 117 test files, 77 source modules)","timestamp":1773739177100,"segment":0}
{"run":136,"commit":"dfd0a25","metric":2000,"metrics":{"god_object_lines":503,"source_modules":77,"test_files":117},"status":"discard","description":"Wire production modules — ConnectionHealthMonitor into PeerConnectionManager (activity tracking, stale cleanup on disconnect), RateLimiter into node-runtime inbound handler (100 req/min per connection). No new tests.","timestamp":1773739438551,"segment":0}
{"run":137,"commit":"b779058","metric":2005,"metrics":{"god_object_lines":503,"source_modules":77,"test_files":118},"status":"keep","description":"Wire production modules into runtime — ConnectionHealthMonitor tracks peer activity/disconnects in PeerConnectionManager, RateLimiter protects inbound handler (100 req/min/conn) with cleanup on disconnect. 5 wiring validation tests.","timestamp":1773739509596,"segment":0}
{"run":138,"commit":"52d18c3","metric":2013,"metrics":{"god_object_lines":503,"source_modules":78,"test_files":119},"status":"keep","description":"GracefulShutdown — process signal handling for production: SIGTERM/SIGINT cleanup, ordered handler execution, timeout protection, double-signal force exit, shutdown state tracking (8 new tests, 78 source modules)","timestamp":1773739638165,"segment":0}
{"run":139,"commit":"f0bc31d","metric":2032,"metrics":{"god_object_lines":503,"source_modules":79,"test_files":120},"status":"keep","description":"Message validation module — production protection: size limits (1MB message, 512KB payload), structure validation, combined validateAndParse pipeline. Prevents OOM from oversized messages. (19 new tests, 79 source modules, 120 test files!)","timestamp":1773739729758,"segment":0}
{"run":140,"commit":"f0bc31d","metric":2032,"metrics":{"god_object_lines":511,"source_modules":79,"test_files":120},"status":"discard","description":"Wire message validation + startup validation into runtime — size check before JSON parse, rate limit cleanup on disconnect. No new tests (pure wiring).","timestamp":1773739864448,"segment":0}
{"run":141,"commit":"2598c50","metric":2034,"metrics":{"god_object_lines":511,"source_modules":79,"test_files":120},"status":"keep","description":"Wire message validation into inbound handler — size check before JSON parse prevents OOM, added 2 wiring tests. Production defense-in-depth: rate limit → size check → parse → route.","timestamp":1773739929580,"segment":0}
{"run":142,"commit":"2598c50","metric":2034,"metrics":{"god_object_lines":511,"source_modules":79,"test_files":120},"status":"discard","description":"Updated autoresearch.md with Session 6 production hardening progress — no code changes","timestamp":1773740018539,"segment":0}
{"run":143,"commit":"8fd956b","metric":2050,"metrics":{"god_object_lines":511,"source_modules":80,"test_files":121},"status":"keep","description":"MetricsCollector — lightweight operational metrics: counters, gauges, snapshot, standard MESH_METRICS constants (inbound/RPC/LLM/peers). Foundation for production monitoring. (16 new tests, 80 source modules, 121 test files)","timestamp":1773740124372,"segment":0}
{"run":144,"commit":"8fd956b","metric":2050,"metrics":{"god_object_lines":511,"source_modules":80,"test_files":121},"status":"discard","description":"Baseline confirmation after context resume — 2050 tests, 80 source modules, 121 test files, god object 511 lines","timestamp":1773740240796,"segment":0}
{"run":145,"commit":"8fd956b","metric":2050,"metrics":{"god_object_lines":511,"source_modules":80,"test_files":121},"status":"discard","description":"Wire startup validation + graceful shutdown into CLI start command — pre-flight checks with blocking error detection, signal-based cleanup replacing raw SIGINT/SIGTERM handlers. No new tests (pure wiring).","timestamp":1773740583823,"segment":0}
{"run":146,"commit":"25bc43c","metric":2055,"metrics":{"god_object_lines":511,"source_modules":80,"test_files":122},"status":"keep","description":"Wire startup validation + graceful shutdown into CLI start — pre-flight checks with blocking error detection, SIGINT/SIGTERM cleanup with timeout + process.exit. 5 integration tests for field-node/command-center configs + shutdown ordering.","timestamp":1773740668260,"segment":0}
{"run":147,"commit":"fa5a8ea","metric":2057,"metrics":{"god_object_lines":517,"source_modules":80,"test_files":122},"status":"keep","description":"Wire MetricsCollector into node-runtime — tracks INBOUND_MESSAGES, INBOUND_RATE_LIMITED, INBOUND_REJECTED on every message. Metrics available on runtime.metrics for health endpoint/dashboard. 2 integration tests.","timestamp":1773740851548,"segment":0}
{"run":148,"commit":"fa5a8ea","metric":2057,"metrics":{"god_object_lines":517,"source_modules":80,"test_files":122},"status":"discard","description":"Wire ConnectionHealthMonitor periodic timer (30s checkAll) + cleanup on stopAll — no new tests (pure wiring)","timestamp":1773741008458,"segment":0}
{"run":149,"commit":"15baf3b","metric":2064,"metrics":{"god_object_lines":517,"source_modules":80,"test_files":123},"status":"keep","description":"Wire ConnectionHealthMonitor periodic timer (30s) + full production stack integration tests — inbound pipeline, health check with metrics, stale detection, validateAndParse. 7 new tests proving production modules work together.","timestamp":1773741088786,"segment":0}
{"run":150,"commit":"76b4216","metric":2080,"metrics":{"god_object_lines":517,"source_modules":81,"test_files":124},"status":"keep","description":"WorldModel snapshot persistence — createSnapshot, saveSnapshot, loadSnapshot, filterSnapshotByAge, isValidSnapshot for fast restart recovery. Avoids cold-start with no sensor context. 16 new tests, 81 source modules.","timestamp":1773741220956,"segment":0}
{"run":151,"commit":"76b4216","metric":2080,"metrics":{"god_object_lines":541,"source_modules":81,"test_files":124},"status":"discard","description":"Wire world model snapshot into runtime lifecycle — restore on start (frames < 1hr), save on stop. God object 517→541 due to wiring. No new tests.","timestamp":1773741442710,"segment":0}
{"run":152,"commit":"eec796f","metric":2081,"metrics":{"god_object_lines":541,"source_modules":81,"test_files":124},"status":"keep","description":"Wire world model snapshot into runtime — restore recent frames on start, save on stop. Production fast-restart: avoids cold-start without sensor context. 1 integration test validating full snapshot round-trip.","timestamp":1773741538458,"segment":0}
{"run":153,"commit":"3fe23c5","metric":2083,"metrics":{"god_object_lines":542,"source_modules":81,"test_files":124},"status":"keep","description":"Expose metrics in health check RPC — mesh.health now returns operational metrics snapshot (counters/gauges). Operators can monitor rate limiting, message volume, peer count from any mesh client. 2 new tests.","timestamp":1773741774406,"segment":0}
{"run":154,"commit":"3fe23c5","metric":2083,"metrics":{"god_object_lines":542,"source_modules":81,"test_files":124},"status":"discard","description":"TUI UX: add planner mode badge (◆/◇) in header, singular/plural peer count. No new tests.","timestamp":1773741995753,"segment":0}
{"run":155,"commit":"3fe23c5","metric":2083,"metrics":{"god_object_lines":542,"source_modules":81,"test_files":124},"status":"discard","description":"Baseline after context resume — 2083 tests, god_object 542. Pivoting to holistic system design work.","timestamp":1774075702938,"segment":0}
{"run":156,"commit":"24528dd","metric":2102,"metrics":{"god_object_lines":542,"source_modules":82,"test_files":125},"status":"keep","description":"Proposal lifecycle safety — expiry (sweepExpired transitions stale proposals to rejected after 30min) + ProposalDedup (prevents duplicate irrigation from multi-planner, 10min window, zone-aware). Addresses real production gap: stale proposals + multi-planner conflicts. 19 tests.","timestamp":1774075865324,"segment":0}
{"run":157,"commit":"da4d37a","metric":2120,"metrics":{"god_object_lines":542,"source_modules":83,"test_files":126},"status":"keep","description":"DataFreshness module — classifies sensor data as fresh/aging/stale/expired based on missed update intervals. Detects sensor node offline, produces planner warnings. Critical for preventing decisions on stale data. 18 new tests.","timestamp":1774075982620,"segment":0}
{"run":158,"commit":"43b349f","metric":2124,"metrics":{"god_object_lines":542,"source_modules":83,"test_files":127},"status":"keep","description":"Wire data freshness into planner context + system design scenario tests. Planner now sees ⚠ warnings for stale sensor data. 4 holistic scenarios: sensor offline→warning, operator walkaway→expiry, dual-planner→dedup, freshness+expiry combined safety net.","timestamp":1774076175730,"segment":0}
{"run":159,"commit":"1bfb1fb","metric":2135,"metrics":{"god_object_lines":542,"source_modules":84,"test_files":128},"status":"keep","description":"SystemEventLog — ring-buffer audit log for production debugging: peer lifecycle, proposals, threshold breaches, mode changes, errors. Fixed capacity, typed events, time-windowed summaries. 11 new tests.","timestamp":1774076293144,"segment":0}
{"run":160,"commit":"d243351","metric":2137,"metrics":{"god_object_lines":571,"source_modules":84,"test_files":128},"status":"keep","description":"Wire SystemEventLog into runtime — captures peer connect/disconnect, proposal created/resolved, startup/shutdown via event bus. Production debuggability: log.recent() shows what happened. God object grew to 571 from wiring (still -24.3% from 754). 2 new tests.","timestamp":1774076606703,"segment":0}
{"run":161,"commit":"624ce8a","metric":2138,"metrics":{"god_object_lines":571,"source_modules":84,"test_files":128},"status":"keep","description":"Wire ProposalDedup into propose_task tool — blocks duplicate proposals for same targetRef+operation+zone within 10min. Prevents double-irrigation from multi-planner setups. 1 integration test.","timestamp":1774076808591,"segment":0}
{"run":162,"commit":"f0ecea1","metric":2144,"metrics":{"god_object_lines":544,"source_modules":85,"test_files":129},"status":"keep","description":"Extract RuntimeSetupHelpers — wireEventLog + snapshot save/restore extracted from god object (571→544, -27 lines). Cleaner separation of wiring logic from orchestration. 7 new tests, 85 source modules.","timestamp":1774076951125,"segment":0}
{"run":163,"commit":"4204d36","metric":2150,"metrics":{"god_object_lines":550,"source_modules":86,"test_files":130},"status":"keep","description":"mesh.events RPC endpoint — remote queryable event log with type filtering, limit clamping, 1hr summary. Wired into runtime. Enables dashboard/CLI debugging of remote nodes. 6 new tests, 86 source modules, 130 test files.","timestamp":1774077105836,"segment":0}
{"run":164,"commit":"4204d36","metric":2150,"metrics":{"god_object_lines":550,"source_modules":86,"test_files":130},"status":"discard","description":"Add clawmesh status CLI command — queries running node's health and events via WebSocket RPC. Operator can check node health without TUI. No new tests (CLI integration).","timestamp":1774077304892,"segment":0}
{"run":165,"commit":"2cda3ab","metric":2153,"metrics":{"god_object_lines":550,"source_modules":86,"test_files":131},"status":"keep","description":"Add clawmesh status CLI command — queries running node health+events via WS RPC. Operators can check node status without TUI: peers, planner mode, world model, metrics, events. 3 formatting tests.","timestamp":1774077371029,"segment":0}
{"run":166,"commit":"f799754","metric":2154,"metrics":{"god_object_lines":550,"source_modules":86,"test_files":131},"status":"keep","description":"Proposal traceability — threshold breach frame IDs now tracked and linked to proposals via extensionState.recentTriggerFrameIds. Operators can trace WHY a proposal was created back to specific sensor readings. 1 new test.","timestamp":1774077547451,"segment":0}
{"run":167,"commit":"c4715f5","metric":2162,"metrics":{"god_object_lines":550,"source_modules":87,"test_files":132},"status":"keep","description":"ProposalContext — enriches proposals with decision-relevant context: current sensor readings for the target zone, pattern history (previous approvals/rejections), freshness warnings. Operators can make informed approve/reject decisions. 8 new tests.","timestamp":1774077690576,"segment":0}
{"run":168,"commit":"d710c16","metric":2165,"metrics":{"god_object_lines":550,"source_modules":87,"test_files":133},"status":"keep","description":"E2E safety validation tests — 3 complete scenarios proving system safety: happy path (sensor→approve→execute), safety net (stale data + expired proposal blocks action), multi-planner dedup (prevents double-irrigation). 3 new tests, 133 test files.","timestamp":1774077960921,"segment":0}
{"run":169,"commit":"d710c16","metric":2165,"metrics":{"god_object_lines":550,"source_modules":87,"test_files":133},"status":"discard","description":"Updated autoresearch.md + ideas backlog with Session 7 progress","timestamp":1774078039740,"segment":0}
{"run":170,"commit":"5c21241","metric":2169,"metrics":{"god_object_lines":550,"source_modules":87,"test_files":134},"status":"keep","description":"Enrich Telegram proposal notifications with current sensor data — operators see 📊 readings for the target zone directly in the notification. Better decision context without querying separately. 4 new tests.","timestamp":1774078192010,"segment":0}
{"run":171,"commit":"5e02e3b","metric":2171,"metrics":{"god_object_lines":550,"source_modules":87,"test_files":135},"status":"keep","description":"TUI events command — operators can type 'e' or 'events' to see recent system events inline. Shows peer connects, threshold breaches, proposals in compact format. 2 new tests, 135 test files (10x original!).","timestamp":1774078367158,"segment":0}
{"run":172,"commit":"5e02e3b","metric":2171,"metrics":{"god_object_lines":550,"source_modules":87,"test_files":135},"status":"discard","description":"Updated autoresearch docs and ideas backlog — Session 7 holistic system design complete","timestamp":1774078479856,"segment":0}
{"run":173,"commit":"6b61fe4","metric":2180,"metrics":{"god_object_lines":550,"source_modules":88,"test_files":136},"status":"keep","description":"CorrelationTracker — traces causal chains: sensor→threshold→planner→proposal→approve→execute. Enables \"why did the pump turn on?\" debugging. Bounded ring buffer, human-readable trace output, findByStage queries. 9 tests + 1 full-trace scenario.","timestamp":1774078575223,"segment":0}
{"run":174,"commit":"6b61fe4","metric":2180,"metrics":{"god_object_lines":550,"source_modules":88,"test_files":136},"status":"discard","description":"Baseline after resume — 2180 tests, 88 modules, 136 test files. Pruned stale ideas.","timestamp":1774078675355,"segment":0}
{"run":175,"commit":"ecf8cd5","metric":2190,"metrics":{"god_object_lines":550,"source_modules":88,"test_files":137},"status":"keep","description":"Handshake security: public key pinning — peer-server now verifies inbound peer's public key matches trust store entry (PUBLIC_KEY_MISMATCH rejection). Prevents impersonation with stolen deviceId. 10 security tests covering timestamp, payload format, key pinning.","timestamp":1774078852680,"segment":0}
{"run":176,"commit":"3fde8e9","metric":2192,"metrics":{"god_object_lines":554,"source_modules":88,"test_files":137},"status":"keep","description":"Wire CorrelationTracker into runtime — sensor.ingest events start causal chains, proposal.created/resolved events extend them. Enables live \"why did the pump turn on?\" tracing via event bus. 2 new wiring tests.","timestamp":1774079023334,"segment":0}
{"run":177,"commit":"9933f1f","metric":2192,"metrics":{"god_object_lines":523,"source_modules":89,"test_files":137},"status":"keep","description":"Extract PiSessionFactory from god object — PiSession creation, event wiring, retry logic moved to pi-session-factory.ts. God object 554→523 (-31 lines, now -30.6% from original 754). 89 source modules.","timestamp":1774079135941,"segment":0}
{"run":178,"commit":"9933f1f","metric":2192,"metrics":{"god_object_lines":523,"source_modules":89,"test_files":137},"status":"crash","description":"Trust store test timed out — beforeAll not imported from vitest, fixing","timestamp":1774086257010,"segment":0}
{"run":179,"commit":"2206a57","metric":2197,"metrics":{"god_object_lines":523,"source_modules":89,"test_files":138},"status":"keep","description":"Trust store security: public key pinning in CLI (--public-key flag), handshake key verification, TOFU mode for unpinned peers. CLI warns when no key pinned. 5 trust store tests + 10 handshake security tests.","timestamp":1774086315625,"segment":0}
{"run":180,"commit":"374de57","metric":2201,"metrics":{"god_object_lines":527,"source_modules":90,"test_files":139},"status":"keep","description":"mesh.trace RPC — remote queryable causal chain tracing. Query by frameId (full trace), by stage (find proposals), or summary. Wired into runtime. Enables \"why did pump turn on?\" from any mesh client. 4 tests, 90 source modules.","timestamp":1774086455292,"segment":0}
